index,url,valid,domain,title,description,image,published,archive,content,quote,language,keyword
https://www.zeit.de/news/2023-12/27/streich-sieht-demokratie-in-gefahr-die-stirn-bieten,https://www.zeit.de/news/2023-12/27/streich-sieht-demokratie-in-gefahr-die-stirn-bieten,0,www.zeit.de,SC Freiburgs Trainer: Streich sieht Demokratie in Gefahr: «Die Stirn bieten»,"Hier finden Sie Informationen zu dem Thema „SC Freiburgs Trainer“. Lesen Sie jetzt „Streich sieht Demokratie in Gefahr: ""Die Stirn bieten""“.",https://img.zeit.de/news/2023-12/27/streich-sieht-demokratie-in-gefahr-die-stirn-bieten-image-group/wide__1300x731,2023-12-27T15:38:22Z,,"Fußballtrainer Christian Streich vom Bundesligisten SC Freiburg sorgt sich um die Demokratie in Deutschland. «Es geht gerade nicht in die richtige Richtung», sagte Streich dem «Kicker» (Donnerstag) i… [+2208 chars]",,de,'SC Freiburg'
https://www.transfermarkt.de/groundhopping-tool-deine-stadionerlebnisse-in-einer-liste-hsv-pokalspiel-meistbesucht/view/news/431282,https://www.transfermarkt.de/groundhopping-tool-deine-stadionerlebnisse-in-einer-liste-hsv-pokalspiel-meistbesucht/view/news/431282,0,www.transfermarkt.de,Groundhopping: Deine Stadionerlebnisse in einer Liste – HSV-Spiel meistbesucht,"Das DFB-Pokalhalbfinale zwischen dem Hamburger SV und dem SC Freiburg (1:3) am 19. April 2022 ist das meistbesuchte Spiel der auf Transfermarkt surfenden User. Also zumindest jener, die sich...",https://tmssl.akamaized.net/images/foto/big/groundhopping-spotlight-dezember-2023-1703694463-125018.jpg?lm=1703694466,2023-12-27T19:02:26Z,,"Mit vielen Zusatzstatistiken 
Das DFB-Pokalhalbfinale zwischen dem Hamburger SV und dem SC Freiburg (1:3) am 19. April 2022 ist das meistbesuchte Spiel der auf Transfermarkt surfenden User. Also zum… [+2320 chars]",,de,'SC Freiburg'
https://www.n-tv.de/sport/fussball/Christian-Streich-warnt-vor-Leuten-wie-Friedrich-Merz-article24626072.html,https://www.n-tv.de/sport/fussball/Christian-Streich-warnt-vor-Leuten-wie-Friedrich-Merz-article24626072.html,0,www.n-tv.de,"""Rigoros die Stirn bieten"": Christian Streich warnt vor Leuten wie Friedrich Merz","Wer wie CDU-Chef Friedrich Merz über Menschen auf der Flucht spricht, ""sollte sich schämen"", sagt Christian Streich. Der Trainer des SC Freiburg bezieht klar Position, sorgt sich um die Demokratie in Deutschland. Er wünscht sich, dass mehr Menschen sich gegen…",https://bilder4.n-tv.de/img/incoming/crop24626127/4271329665-cImg_16_9-w1200/imago1038019566h.jpg,2023-12-28T07:58:42Z,https://web.archive.org/web/20231228180006/https://www.n-tv.de/sport/fussball/Christian-Streich-warnt-vor-Leuten-wie-Friedrich-Merz-article24626072.html,"Wer wie CDU-Chef Friedrich Merz über Menschen auf der Flucht spricht, ""sollte sich schämen"", sagt Christian Streich. Der Trainer des SC Freiburg bezieht klar Position, sorgt sich um die Demokratie in… [+2802 chars]",,de,'SC Freiburg'
https://www.transfermarkt.de/hannibal-verzichtet-fur-winter-transfer-auf-afrika-cup-freiburg-unter-interessenten/view/news/431747,https://www.transfermarkt.de/hannibal-verzichtet-fur-winter-transfer-auf-afrika-cup-freiburg-unter-interessenten/view/news/431747,0,www.transfermarkt.de,SC Freiburg: Kommt Hannibal? United-Profi verzichtet auf Afrika-Cup,"Bei der Bekanntgabe des tunesischen Kaders für den im Januar anstehenden Afrika-Cup fehlte am Donnerstag der Name Hannibal. Der 20 Jahre alte Mittelfeldspieler von Manchester United,...",https://tmssl.akamaized.net/images/foto/big/hannibal-mejbri-tunesien-2022-1668683350-96652.jpg?lm=1668683361,2023-12-28T13:49:46Z,https://web.archive.org/web/20231228160413/https://www.transfermarkt.de/hannibal-verzichtet-fur-winter-transfer-auf-afrika-cup-freiburg-unter-interessenten/view/news/431747,"Tunesischer Man-United-Profi 
Bei der Bekanntgabe des tunesischen Kaders für den im Januar anstehenden Afrika-Cup fehlte am Donnerstag der Name Hannibal. Der 20 Jahre alte Mittelfeldspieler von Manc… [+2787 chars]",,de,'SC Freiburg'
https://www.transfermarkt.de/verletzter-wiklof-erhalt-profivertrag-beim-sc-freiburg-naturlich-ein-tolles-gefuhl-quot-/view/news/431766,https://www.transfermarkt.de/verletzter-wiklof-erhalt-profivertrag-beim-sc-freiburg-naturlich-ein-tolles-gefuhl-quot-/view/news/431766,0,www.transfermarkt.de,Verletzter Oscar Wiklöf erhält Profivertrag beim SC Freiburg,Oscar Wiklöf hat nach Angaben von „Ålands Radio & TV“ einen Profivertrag beim SC Freiburg unterzeichnet. „Das ist natürlich ein tolles Gefühl....,https://tmssl.akamaized.net/images/foto/big/oscar-wiklof-sc-freiburg-ii-2022-23-1703841748-125151.jpg?lm=1703841766,2023-12-29T08:49:26Z,https://web.archive.org/web/20231229101303/https://www.transfermarkt.de/verletzter-wiklof-erhalt-profivertrag-beim-sc-freiburg-naturlich-ein-tolles-gefuhl-quot-/view/news/431766,"Oscar Wiklöf hat nach Angaben von „Ålands Radio &amp; TV“ einen Profivertrag beim SC Freiburg unterzeichnet. „Das ist natürlich ein tolles Gefühl. Das ist ein Ziel, das ich verfolge, seitdem ich bei … [+490 chars]",,de,'SC Freiburg'
https://www.bild.de/bild-plus/sport/fussball/sc-freiburg/sc-freiburg-das-ist-der-geheime-winter-plan-von-christian-streich-86562248.bild.html,https://www.bild.de/bild-plus/sport/fussball/sc-freiburg/sc-freiburg-das-ist-der-geheime-winter-plan-von-christian-streich-86562248.bild.html,0,www.bild.de,*** BILDplus Inhalt *** Kommt ein ManUnited-Star? - Freiburgs geheimer Winter-Transfer-Plan,Der SC Freiburg will seinen Kader trotz ordentlicher Bundesliga-Hinrunde weiter verbessern. BILD deckt den Winter-Plan der Bosse und Christian Streich auf.,"https://images.bild.de/658d5a9696bd820140244b59/97be2d6dc848957bbf228092ac08a115,d0164031?w=1280",2023-12-29T11:36:01Z,https://web.archive.org/web/20231229150255/https://www.bild.de/bild-plus/sport/fussball/sc-freiburg/sc-freiburg-das-ist-der-geheime-winter-plan-von-christian-streich-86562248.bild.html,"Der SC Freiburg blickt sportlich auf eine ordentliche Hinrunde zurück. Trotzdem hat der Kader Baustellen, vor allem in der Breite. Das haben auch die Bosse und Trainer Christian Streich (58) erkannt.… [+160 chars]",,de,'SC Freiburg'
https://www.welt.de/sport/article249274310/SC-Freiburg-Christian-Streich-kritisiert-Friedrich-Merz-und-die-AfD.html,https://www.welt.de/sport/article249274310/SC-Freiburg-Christian-Streich-kritisiert-Friedrich-Merz-und-die-AfD.html,0,www.welt.de,„Sollte sich schämen“ – Streich attackiert CDU-Chef Merz,Christian Streich bringt sich immer wieder in gesellschaftliche Debatten ein. Nun kritisiert der Trainer des SC Freiburg den CDU-Chef Friedrich Merz. Es geht Streich um eine Aussage zu Asylbewerbern. Der Trainer formuliert zudem einen deutlichen Appell.,https://img.welt.de/img/sport/mobile249274378/2211351047-ci16x9-w1200/Christian-Streich.jpg,2023-12-29T15:55:50Z,,"Christian Streich sorgt sich um die Demokratie in Deutschland und kritisiert den CDU-Chef Friedrich Merz.Ohne dessen Namen direkt zu nennen, sagte der Trainer des Fußball-Bundesligaklubs SC Freiburg … [+1442 chars]",,de,'SC Freiburg'
https://www.transfermarkt.de/-exot-quot-volker-finke-uber-sein-gluck-in-freiburg-und-den-verschaukelten-quot-cardoso/view/news/407709,https://www.transfermarkt.de/-exot-quot-volker-finke-uber-sein-gluck-in-freiburg-und-den-verschaukelten-quot-cardoso/view/news/407709,0,www.transfermarkt.de,SC Freiburg: Volker Finke über sein „Glück“ & nicht existente Verträge,"Der Trainerverschleiß im deutschen Profifußball steht nicht selten im Fokus, wenn ein Übungsleiter eines Klubs vermeintlich vorschnell entlassen wird. Als absolutes...",https://tmssl.akamaized.net/images/foto/big/volker-finke-interview-spot-1657801164-88424.jpg?lm=1657801168,2023-12-30T18:00:00Z,,"SC-Kulttrainer im Interview 
Der Trainerverschleiß im deutschen Profifußball steht nicht selten im Fokus, wenn ein Übungsleiter eines Klubs vermeintlich vorschnell entlassen wird. Als absolutes Gege… [+11781 chars]",,de,'SC Freiburg'
… [+896 chars],,de,'SC Freiburg',,,,,,,,,
