index,url,valid,domain,title,description,image,published,archive,content,quote,language,keyword
https://www.kicker.de/zwei-glanztaten-ginter-trotzt-dem-fehlerfestival-969916/artikel,https://www.kicker.de/zwei-glanztaten-ginter-trotzt-dem-fehlerfestival-969916/artikel,0,www.kicker.de,Zwei Glanztaten: Ginter trotzt dem Fehlerfestival,"Weil sich der SC Freiburg selbst im Weg stand, war der 3:2-Erfolg zum Auftakt in die Europa League harte Arbeit. Matthias Ginter war in der Defensive der Einzige, der sich nicht zu Fehlern hinreißen ließ.","https://derivates.kicker.de/image/upload/c_crop,x_21,y_219,w_2065,h_1162/w_1200,q_auto/v1/2023/09/22/58d96f9f-43c9-485f-8673-e149f53d7e3d.jpeg",2023-09-22T09:57:48Z,,"Weil sich der SC Freiburg selbst im Weg stand, war der 3:2-Erfolg zum Auftakt in die Europa League harte Arbeit. Matthias Ginter war in der Defensive der Einzige, der sich nicht zu Fehlern hinreißen … [+5548 chars]",,de,'SC Freiburg'
https://www.stern.de/gesellschaft/regional/baden-wuerttemberg/bundesliga--infektion-der-unterarmfraktur--freiburg-weiter-ohne-guenter-33850614.html,https://www.stern.de/gesellschaft/regional/baden-wuerttemberg/bundesliga--infektion-der-unterarmfraktur--freiburg-weiter-ohne-guenter-33850614.html,0,www.stern.de,Bundesliga: Infektion der Unterarmfraktur: Freiburg weiter ohne Günter,"Der SC Freiburg muss noch längere Zeit auf seinen Kapitän Christian Günter verzichten. Wegen einer Infektion seiner ursprünglich erlittenen offenen Unterarmfraktur müsse der 30 Jahre alte Außenverteidiger ""längerfristig medizinisch und operativ behandelt werd…",https://image.stern.de/33850616/t/SN/v1/w1440/r1.7778/-/22--urnnewsmldpacom2009010123092299293376v2w800h600l570t77r1389b622jpeg---bcb89961430d8df6.jpg,2023-09-22T10:30:15Z,,Der SC Freiburg muss noch längere Zeit auf seinen Kapitän Christian Günter verzichten. Wegen einer Infektion seiner ursprünglich erlittenen offenen Unterarmfraktur müsse der 30 Jahre alte Außenvertei… [+956 chars],,de,'SC Freiburg'
https://www.bild.de/sport/fussball/sc-freiburg-die-geheimnisse-hinter-maerchen-rueckkehr-von-maxi-philipp-85496374.bild.html,https://www.bild.de/sport/fussball/sc-freiburg-die-geheimnisse-hinter-maerchen-rueckkehr-von-maxi-philipp-85496374.bild.html,0,www.bild.de,Was Fans damit zu tun haben - Die Geheimnisse hinter Philipps Märchen-Rückkehr,Vom verlorenen Sohn zum Euro-Held! Maxi Philipp hat beim SC Freiburg Eindruck hinterlassen. BILD erklärt: die Geheimnisse hinter der Philipp-Rückkehr.,"https://images.bild.de/650d57078accb27f007053b9/d7a5dccc30af61b6c68ae5e6ff819985,9f47f52?w=1280",2023-09-22T10:54:31Z,,"Was eine Geschichte!
Ausgerechnet Maximilian Philipp (58) wird beim SC Freiburg im ersten Europa-League-Spiel in dieser Saison beim 3:2-Sieg bei Olympiakos Piräus zum Helden.
Mit BILDplus lesen Sie… [+114 chars]",,de,'SC Freiburg'
https://www.transfermarkt.de/gunter-fehlt-freiburg-weiter-muss-bdquo-langerfristig-medizinisch-und-operativ-behandelt-werden-ldquo-/view/news/428284,https://www.transfermarkt.de/gunter-fehlt-freiburg-weiter-muss-bdquo-langerfristig-medizinisch-und-operativ-behandelt-werden-ldquo-/view/news/428284,0,www.transfermarkt.de,Christian Günter fehlt SC Freiburg noch länger: Operative Behandlung,Der SC Freiburg muss noch längere Zeit auf seinen Kapitän Christian Günter verzichten. Wegen einer Infektion seiner ursprünglich erlittenen offenen Unterarmfraktur...,https://tmssl.akamaized.net/images/foto/big/christian-gunter-sc-freiburg-2023-1676357235-101950.jpg?lm=1676357242,2023-09-22T11:15:16Z,,Der SC Freiburg muss noch längere Zeit auf seinen Kapitän Christian Günter verzichten. Wegen einer Infektion seiner ursprünglich erlittenen offenen Unterarmfraktur müsse der 30 Jahre alte Außenvertei… [+518 chars],,de,'SC Freiburg'
https://www.tagesspiegel.de/gesellschaft/genuss/weinlese-in-deutschland-was-wird-uns-der-neue-jahrgang-bringen-10498528.html,https://www.tagesspiegel.de/gesellschaft/genuss/weinlese-in-deutschland-was-wird-uns-der-neue-jahrgang-bringen-10498528.html,0,www.tagesspiegel.de,Weinlese in Deutschland: Was wird uns der neue Jahrgang bringen?,"Der Sommer war zeitweise verregnet, der Klimawandel setzt den Winzern zu. Was können Weinliebhaber vom Jahrgang 2023 erwarten? Drei Einschätzungen.",,2023-09-22T11:55:43Z,,Auf eine trockene Phase folgten diesen Sommer üppige Regenfälle. Wie hat sich das auf die Weinanbaugebiete in Deutschland ausgewirkt? In unserer Serie 3 auf 1 geben drei Experten eine Einschätzung da… [+4094 chars],,de,'Weinlese'
https://www.kicker.de/rode-fehlt-frankfurt-erneut-goetze-fraglich-969953/artikel,https://www.kicker.de/rode-fehlt-frankfurt-erneut-goetze-fraglich-969953/artikel,0,www.kicker.de,Rode fehlt Frankfurt erneut - Götze fraglich,"Nach dem Arbeitssieg in der Conference League wartet auf Eintracht Frankfurt am Sonntag der SC Freiburg. Trainer Dino Toppmöller deutet personelle Veränderungen an - und erklärt, warum er Julian Nagelsmann nicht ""nerven"" wollte.","https://derivates.kicker.de/image/upload/c_crop,x_0,y_159,w_4000,h_2250/w_1200,q_auto/v1/2023/09/22/c097e791-32d5-4784-b128-d2a931660cff.jpeg",2023-09-22T13:00:00Z,,"Nach dem Arbeitssieg in der Conference League wartet auf Eintracht Frankfurt am Sonntag der SC Freiburg. Trainer Dino Toppmöller deutet personelle Veränderungen an - und erklärt, warum er Julian Nage… [+4420 chars]",,de,'SC Freiburg'
https://www.faz.net/aktuell/sport/fussball/bundesliga/fussball-bundesliga-haertetest-fuer-eintracht-frankfurt-gegen-sc-freiburg-19194239.html,https://www.faz.net/aktuell/sport/fussball/bundesliga/fussball-bundesliga-haertetest-fuer-eintracht-frankfurt-gegen-sc-freiburg-19194239.html,0,www.faz.net,Frankfurt vor Härtetest: Mit mehr Spaß gegen den SC Freiburg?,Spielkultur statt Defensivfußball: Auf die Frankfurter wartet gegen den SC Freiburg ein „interessantes Spiel mit offenem Visier“. Vor dem Gegner hat Eintracht-Trainer Toppmöller großen Respekt.,https://media0.faz.net/ppmedia/aktuell/sport/535071494/1.9194278/facebook_teaser/dino-toppmoeller-spricht-von.jpg,2023-09-23T09:00:01Z,,"Schöne Grüße nach Aberdeen. Am Tag danach hat Dino Toppmöller seine Vorfreude auf Freiburg zum Ausdruck gebracht. Mit dem Sportclub kommt jetzt eine Mannschaft zu uns, die wie wir Fußball spielen wil… [+4968 chars]",,de,'SC Freiburg'
https://www.kicker.de/grifo-kommt-wieder-ein-hexenkessel-auf-uns-zu-970081/artikel,https://www.kicker.de/grifo-kommt-wieder-ein-hexenkessel-auf-uns-zu-970081/artikel,0,www.kicker.de,"Grifo: ""Kommt wieder ein Hexenkessel auf uns zu""","Die Voraussetzungen vor dem Spiel des SC Freiburg bei Eintracht Frankfurt (Sonntag, 17.30 Uhr) sind für beide Teams ähnlich, da sie am Donnerstagabend europäisch im Einsatz waren. Für die Freiburger kam allerdings noch der Reisestress hinzu.","https://derivates.kicker.de/image/upload/c_crop,x_0,y_148,w_3168,h_1782/w_1200,q_auto/v1/2023/09/23/80462b67-2f46-4f78-b111-4824e11e2132.jpeg",2023-09-23T10:07:42Z,,"Die Voraussetzungen vor dem Spiel des SC Freiburg bei Eintracht Frankfurt (Sonntag, 17.30 Uhr) sind für beide Teams ähnlich, da sie am Donnerstagabend europäisch im Einsatz waren. Für die Freiburger … [+3798 chars]",,de,'SC Freiburg'
https://www.faz.net/aktuell/feuilleton/debatten/die-partei-die-partei-nominiert-sibylle-berg-19196174.html,https://www.faz.net/aktuell/feuilleton/debatten/die-partei-die-partei-nominiert-sibylle-berg-19196174.html,0,www.faz.net,"Sonneborn, Berg und eine Handvoll Wagners: Der Bundesparteitag der Partei DIE PARTEI","Mannschaft steht: Die PARTEI zieht mit der Schriftstellerin Sibylle Berg, einigen Wagners und dem Vorsitzenden Sonneborn in den EU-Wahlkampf.",https://media1.faz.net/ppmedia/aktuell/118818479/1.9196175/facebook_teaser/in-der-grossen-politik-spricht.jpg,2023-09-23T16:12:20Z,,Die Partei Die PARTEI zieht mit einer ideologisch kampferfahrenen Schriftstellerin und einer Gruppe Wagner in den EU-Wahlkampf. Diese auf den ersten Blick überraschenden Personalien wurden auf dem PA… [+1544 chars],,de,'Martin Sonneborn'
https://www.focus.de/sport/fussball/bundesliga1/bundesliga-5-spieltag-eintracht-frankfurt-gegen-sc-freiburg-im-liveticker_id_211988002.html,https://www.focus.de/sport/fussball/bundesliga1/bundesliga-5-spieltag-eintracht-frankfurt-gegen-sc-freiburg-im-liveticker_id_211988002.html,0,www.focus.de,"Bundesliga, 5. Spieltag - Eintracht Frankfurt gegen SC Freiburg im Liveticker","0:5 in Stuttgart, 2:4 gegen den BVB - in der Bundesliga lief es für den SC Freiburg zuletzt überhaupt nicht wie gewünscht. Hilft das Erfolgserlebnis von der Europa League? Heute muss Christian Streich mit seinem Team bei Eintracht Frankfurt ran. Das Spiel im …",https://p6.focus.de/img/fotos/id_207010043/eintracht-frankfurts-mario-goetze.jpg?im=Crop%3D%280%2C0%2C3464%2C1732%29%3BResize%3D%281200%2C627%29&impolicy=perceptual&quality=mediumHigh&hash=c36da2ee3b8673f604ee2c18b39450d722e6ac2243d9826cf48c42cd9b2500fe,2023-09-24T13:05:44Z,,"0:5 in Stuttgart, 2:4 gegen den BVB - in der Bundesliga lief es für den SC Freiburg zuletzt überhaupt nicht wie gewünscht. Hilft das Erfolgserlebnis von der Europa League? Heute muss Christian Streic… [+2359 chars]",,de,'SC Freiburg'
https://www.transfermarkt.de/viertes-remis-in-folge-fur-frankfurt-sge-und-freiburg-teilen-sich-punkte/view/news/428331,https://www.transfermarkt.de/viertes-remis-in-folge-fur-frankfurt-sge-und-freiburg-teilen-sich-punkte/view/news/428331,0,www.transfermarkt.de,Bundesliga: Eintracht Frankfurt und SC Freiburg teilen sich Punkte,Kein Sieger im Duell der Europacup-Starter: In einem intensiven Abnutzungskampf haben sich Eintracht Frankfurt und der SC Freiburg zum Abschluss des 5. Spieltages in der Bundesliga...,https://tmssl.akamaized.net/images/foto/big/mario-gotze-eintracht-frankfurt-maximilian-eggestein-sc-freiburg-2023-1695576276-117567.jpg?lm=1695576304,2023-09-24T17:32:21Z,,"Vor den Augen von Nagelsmann 
Kein Sieger im Duell der Europacup-Starter: In einem intensiven Abnutzungskampf haben sich Eintracht Frankfurt und der SC Freiburg zum Abschluss des 5. Spieltages in de… [+2621 chars]",,de,'SC Freiburg'
https://www.stern.de/sport/fussball/bundesliga-5-spieltag--leverkusen-gewinnt-und-verliert-trotzdem-die-tabellenfuehrung--nullnummer-in-frankfurt-33853376.html,https://www.stern.de/sport/fussball/bundesliga-5-spieltag--leverkusen-gewinnt-und-verliert-trotzdem-die-tabellenfuehrung--nullnummer-in-frankfurt-33853376.html,0,www.stern.de,"5. Bundesliga-Spieltag: Leverkusen gewinnt und verliert trotzdem die Tabellenführung, Nullnummer in Frankfurt",Schon wieder hoch gewonnen - aber nicht hoch genug: Bayer Leverkusen unterstreicht gegen Aufsteiger 1. FC Heidenheim seine beeindruckende Form. Eintracht Frankfurt  kommt über ein 0:0 gegen den SC Freiburg nicht hinaus.,https://image.stern.de/33855318/t/0p/v1/w1440/r1.7778/-/bundesliga-frankfurt-freiburg.jpg,2023-09-24T17:34:00Z,,Mit sechs Toren Unterschied hätte Bayer Leverkusen für die Rückkehr an die Tabellenspitze gewinnen müssen. Das gelang trotz vieler Chancen gegen Heidenheim bei weitem nicht. Um Serienmeister FC Bayer… [+1249 chars],,de,'SC Freiburg'
https://www.stern.de/sport/5--spieltag--nullnummer-zwischen-frankfurt-und-freiburg-33855414.html,https://www.stern.de/sport/5--spieltag--nullnummer-zwischen-frankfurt-und-freiburg-33855414.html,0,www.stern.de,5. Spieltag: Nullnummer zwischen Frankfurt und Freiburg,Eintracht Frankfurt und der SC Freiburg hängen nach einer Nullnummer weiter im Tabellenmittelfeld fest. Beiden Teams fehlt im Angriff die Durchschlagskraft.,https://image.stern.de/33855416/t/sC/v1/w1440/r1.7778/-/24--urnnewsmldpacom2009010123092499318452v3w800h600l755t89r2035b942jpeg---a09b935b0d5f04da.jpg,2023-09-24T18:06:25Z,,"Eintracht Frankfurt und der SC Freiburg hängen nach einer Nullnummer weiter im Tabellenmittelfeld fest. Beiden Teams fehlt im Angriff die Durchschlagskraft.
Kein Sieger im Duell der Europacup-Starte… [+3610 chars]",,de,'SC Freiburg'
https://www.tagesspiegel.de/sport/torloses-duell-der-europacup-starter-eintracht-frankfurt-und-sc-freiburg-trennen-sich-00-10522603.html,https://www.tagesspiegel.de/sport/torloses-duell-der-europacup-starter-eintracht-frankfurt-und-sc-freiburg-trennen-sich-00-10522603.html,0,www.tagesspiegel.de,Duell der Europacup-Starter bleibt torlos: Eintracht Frankfurt und SC Freiburg trennen sich 0:0,Eintracht Frankfurt und der SC Freiburg hängen nach einer Nullnummer weiter im Tabellenmittelfeld fest. Beiden Teams fehlt im Angriff die Durchschlagskraft.,https://www.tagesspiegel.de/images/imago1034763820hjpg/alternates/BASE_16_9_W1400/imago1034763820hjpg.jpeg,2023-09-24T18:52:47Z,,Kein Sieger im Duell der Europacup-Starter: In einem intensiven Abnutzungskampf haben sich Eintracht Frankfurt und der SC Freiburg zum Abschluss des fünften Spieltages in der Fußball-Bundesliga torlo… [+4109 chars],,de,'SC Freiburg'
https://www.kicker.de/streich-stolz-auf-stabile-hoch-engagierte-mannschaftsleistung-970296/video,https://www.kicker.de/streich-stolz-auf-stabile-hoch-engagierte-mannschaftsleistung-970296/video,0,www.kicker.de,"Streich stolz auf ""stabile, hoch engagierte Mannschaftsleistung""",Video: Der SC Freiburg und Frankfurt trennen sich mit einem torlosen Remis. Angesichts der neun Gegentore aus den letzten zwei Bundesliga-Spielen zeigt sich Trainer Christian Streich mit dem Ergebnis zufrieden.,"https://derivates.kicker.de/image/upload/c_crop,x_0,y_127,w_1755,h_987/w_1200,q_auto/v1/2023/09/24/3c7acb80-32fa-4335-85cc-0ba19769da6d.jpeg",2023-09-24T20:35:06Z,,"Werbung und Tracking: Um dir relevante Inhalte und personalisierte Werbung anzubieten, setzen wir Cookies und andere Technologien ein. Damit messen wir, wie und womit du unsere Angebote nutzt. Diese … [+2186 chars]",,de,'SC Freiburg'
https://www.nzz.ch/feuilleton/martin-sonneborn-titanic-boehmermann-schmidt-humor-ld.1756874,https://www.nzz.ch/feuilleton/martin-sonneborn-titanic-boehmermann-schmidt-humor-ld.1756874,0,www.nzz.ch,"INTERVIEW - Ex-«Titanic»-Chef Martin Sonneborn: «Ich habe den öffentlichrechtlichen Rundfunk lange verteidigt, sehe aber immer weniger Gründe dafür. Kritischen Journalismus sehe ich selten»","Martin Sonneborn politisiert seit 2014 im Europaparlament, für eine Satire-Partei, die nicht nur Satire macht. Ein Interview über deutsche Humorprobleme, unlustige Grüne, Jan Böhmermann und den öffentlich-rechtlichen Rundfunk.","https://img.nzz.ch/2023/09/19/6cd207b1-f780-45fd-92e0-8e7b65addffb.jpeg?width=1200&height=675&fit=bound&quality=75&auto=webp&crop=4954,2787,x0,y41&wmark=nzz",2023-09-25T03:30:00Z,,"Martin Sonneborn, Bundesvorsitzender von Die PARTEI. Seine Kappe trägt die Aufschrift: «Make Europe Knorke Again».
Martin Sonneborn war fünf Jahre lang Chefredaktor des Satiremagazins «Titanic» und … [+5699 chars]",,de,'Martin Sonneborn'
https://www.faz.net/aktuell/sport/fussball/bundesliga/eintracht-frankfurt-gegen-sc-freiburg-lob-fuer-schiedsrichter-felix-zwayer-19198638.html,https://www.faz.net/aktuell/sport/fussball/bundesliga/eintracht-frankfurt-gegen-sc-freiburg-lob-fuer-schiedsrichter-felix-zwayer-19198638.html,0,www.faz.net,Lob für Zwayer in Bundesliga: „Das war überragend vom Schiedsrichter“,Im Duell zwischen Eintracht Frankfurt und dem SC Freiburg hat Schiedsrichter Zwayer zwei knifflige Situationen zu bewerten – und liegt bei beiden Entscheidungen richtig. Das freut die Trainer.,https://media0.faz.net/ppmedia/aktuell/2558095820/1.9198690/facebook_teaser/schiedsrichter-felix-zwayer.jpg,2023-09-25T06:58:38Z,,Seltenes Lob: Nach der Nullnummer zwischen Eintracht Frankfurt und dem SC Freiburg haben die Trainer der beiden Rivalen die souveräne Spielleitung von Schiedsrichter Felix Zwayer einmütig hervorgehob… [+1997 chars],,de,'SC Freiburg'
https://www.faz.net/aktuell/feuilleton/debatten/die-partei-schriftstellerin-sibylle-berg-zieht-in-den-eu-wahlkampf-19197091.html,https://www.faz.net/aktuell/feuilleton/debatten/die-partei-schriftstellerin-sibylle-berg-zieht-in-den-eu-wahlkampf-19197091.html,0,www.faz.net,Unter einer üppigen Schicht humorvollen Torfs: Sibylle Berg zieht für die PARTEI in den EU-Wahlkampf,Die Satire-Partei Die PARTEI nominiert die Schriftstellerin Sibylle Berg als Spitzenkandidatin für die EU-Wahl. Kann sie Europameisterin werden? Ein Interview.,https://media1.faz.net/ppmedia/aktuell/3660744292/1.7996015/facebook_teaser_fplus/sibylle-berg-im-jahr-2018.jpg,2023-09-25T07:42:33Z,,"Sibylle Berg, 1962 in Weimar geboren, schreibt Romane, Theaterstücke und Hörspiele. Schon ihr Romandebüt Ein paar Leute suchen das Glück und lachen sich tot, das sich in sechsstelliger Zahl verkaufte… [+622 chars]",,de,'Martin Sonneborn'
https://www.welt.de/sport/fussball/bundesliga/article247651416/Bundesliga-Streich-und-Toppmoeller-loben-Schiedsrichter-Zwayer.html,https://www.welt.de/sport/fussball/bundesliga/article247651416/Bundesliga-Streich-und-Toppmoeller-loben-Schiedsrichter-Zwayer.html,0,www.welt.de,Nach dem Spiel gibt es ein bemerkenswertes Plädoyer für die Schiedsrichter,In der Partie zwischen Eintracht Frankfurt und dem SC Freiburg hat Schiedsrichter Felix Zwayer zwei knifflige Situationen zu bewerten – und liegt beide Male richtig. Im Anschluss loben beide Trainer den Unparteiischen – und brechen eine Lanze für ihn und dess…,https://img.welt.de/img/sport/mobile247651818/5261356267-ci16x9-w1200/Eintracht-Frankfurt-SC-Freiburg.jpg,2023-09-25T09:22:01Z,,"Sie stehen nicht selten in der Kritik. Wenn Bundesliga-Spiele vorüber sind, lassen Spieler und Trainer den Frust oft auch ihnen ab, den Schiedsrichten. Im Nachgang des 0:0 zwischen Eintracht Frankfur… [+2193 chars]",,de,'SC Freiburg'
https://www.kicker.de/sorgt-alario-fuer-den-noetigen-punch-es-liegt-an-ihm-es-gibt-nichts-geschenkt-970428/artikel,https://www.kicker.de/sorgt-alario-fuer-den-noetigen-punch-es-liegt-an-ihm-es-gibt-nichts-geschenkt-970428/artikel,0,www.kicker.de,"Sorgt Alario für den nötigen Punch? ""Es liegt an ihm, es gibt nichts geschenkt""",Eintracht Frankfurt belohnte sich gegen den SC Freiburg nicht - mal wieder wegen fehlender Torgefahr. Der einzige klassische Neuner im Kader soll helfen und dürfte zeitnah seine Chance bekommen.,"https://derivates.kicker.de/image/upload/c_crop,x_0,y_0,w_3200,h_1800/w_1200,q_auto/v1/2023/09/25/49bff6e7-d8c2-4542-89dc-131f80afef39.jpeg",2023-09-25T14:07:50Z,,"Eintracht Frankfurt belohnte sich gegen den SC Freiburg nicht - mal wieder wegen fehlender Torgefahr. Der einzige klassische Neuner im Kader soll helfen und dürfte zeitnah seine Chance bekommen. 
 N… [+4190 chars]",,de,'SC Freiburg'
https://www.kicker.de/stamm-das-reicht-dann-in-dieser-liga-nicht-970426/artikel,https://www.kicker.de/stamm-das-reicht-dann-in-dieser-liga-nicht-970426/artikel,0,www.kicker.de,"Stamm: ""Das reicht dann in dieser Liga nicht""",Es läuft nicht gut für den SC Freiburg II in dieser Saison. Trainer Thomas Stamm vermisst weiterhin die Stabilität.,"https://derivates.kicker.de/image/upload/c_crop,x_585,y_29,w_2857,h_1607/w_1200,q_auto/v1/2023/09/25/47d94d26-618a-4c5c-9388-8449602a0693.jpeg",2023-09-25T14:09:25Z,,Es läuft nicht gut für den SC Freiburg II in dieser Saison. Trainer Thomas Stamm vermisst weiterhin die Stabilität. Vizemeister Freiburg verharrt auf dem vorletzten Platz. Der Sport-Club konnte nicht… [+1995 chars],,de,'SC Freiburg'
https://www.bild.de/sport/fussball/sc-freiburg-christian-streich-trickst-bundesliga-abwehr-dicht-85526152.bild.html,https://www.bild.de/sport/fussball/sc-freiburg-christian-streich-trickst-bundesliga-abwehr-dicht-85526152.bild.html,0,www.bild.de,Geheime Maßnahme enthüllt - So trickst Streich Freiburgs Abwehr dicht!,Für weniger Gegentore greift Christian Streich beim SC Freiburg zu besonderen Maßnahmen. Mit welchem Trick der Trainer vor dem Frankfurt-Spiel überraschte.,"https://images.bild.de/65116236c482dd032d800b9a/d82ce8869f1eb039bde95650f72eaf61,7bee56eb?w=1280",2023-09-25T14:35:04Z,,"Er macht die Trick-Kiste auf!
Der SC Freiburg arbeitet aktuell an einer besseren Defensive.
Zu welcher besonderen Maßnahme Trainer Christian Streich (58) vor dem Frankfurt-Spiel griff und was müde … [+48 chars]",,de,'SC Freiburg'
https://www.kicker.de/raus-aus-der-achterbahn-freiburg-haelt-mal-wieder-die-null-970451/artikel,https://www.kicker.de/raus-aus-der-achterbahn-freiburg-haelt-mal-wieder-die-null-970451/artikel,0,www.kicker.de,Raus aus der Achterbahn: Freiburg hält mal wieder die Null,Erleichterung im Breisgau: Der SC Freiburg hat die jüngsten Negativerlebnisse verarbeitet und nach dem Sieg in Piräus auch in Frankfurt bestanden. Ein Problem beschäftigt den Klub aber längerfristig.,"https://derivates.kicker.de/image/upload/c_crop,x_0,y_0,w_3557,h_2001/w_1200,q_auto/v1/2023/09/25/be7c3b3a-6b67-440b-ba9d-941f094d8359.jpeg",2023-09-25T16:06:25Z,,Erleichterung im Breisgau: Der SC Freiburg hat die jüngsten Negativerlebnisse verarbeitet und nach dem Sieg in Piräus auch in Frankfurt bestanden. Ein Problem beschäftigt den Klub aber längerfristig.… [+4137 chars],,de,'SC Freiburg'
https://www.zeit.de/news/2023-09/25/weinlese-an-historischem-weinberg,https://www.zeit.de/news/2023-09/25/weinlese-an-historischem-weinberg,0,www.zeit.de,Agrar: Weinlese an historischem Weinberg,,,2023-09-25T16:24:33Z,,"When browsing with ads:
We collect personal data and also transmit it to third-party providers
 that help us improve and finance our digital content. Some of the information stored on your device, … [+821 chars]",,de,'Weinlese'
https://www.stern.de/gesellschaft/regional/berlin-brandenburg/agrar--weinlese-an-historischem-weinberg-33858276.html,https://www.stern.de/gesellschaft/regional/berlin-brandenburg/agrar--weinlese-an-historischem-weinberg-33858276.html,0,www.stern.de,Agrar: Weinlese an historischem Weinberg,"Am Königlichen Weinberg in Potsdam wird in diesem Jahr ein guter Jahrgang erwartet. Das Weinjahr 2023 sei sehr herausfordernd gewesen, die Trauben hätten aber hervorragend reifen können, teilte Projektkoordinator Andreas Kramp mit. Am Montag begann die Weinle…",https://image.stern.de/33858278/t/lm/v1/w1440/r1.7778/-/25--urnnewsmldpacom2009010123092599330767v3w800h600l432t166r1653b1511jpeg---703439cf4f41e068.jpg,2023-09-25T16:24:33Z,,"Am Königlichen Weinberg in Potsdam wird in diesem Jahr ein guter Jahrgang erwartet. Das Weinjahr 2023 sei sehr herausfordernd gewesen, die Trauben hätten aber hervorragend reifen können, teilte Proje… [+1426 chars]",,de,'Weinlese'
https://www.morgenpost.de/berlin/article239666249/Weinlese-an-historischem-Weinberg.html,https://www.morgenpost.de/berlin/article239666249/Weinlese-an-historischem-Weinberg.html,0,www.morgenpost.de,Agrar: Weinlese an historischem Weinberg,"Am Königlichen Weinberg in Potsdam wird in diesem Jahr ein guter Jahrgang erwartet. Das Weinjahr 2023 sei sehr herausfordernd gewesen, die Trauben hätten aber hervorragend reifen können, teilte Projektkoordinator Andreas Kramp mit. Am Montag begann die Weinle…",https://img.morgenpost.de/img/berlin/crop239666247/5382608815-w820-cv16_9-q85/Beginn-der-Weinlese-in-Potsdam-Sanssouci.jpg,2023-09-25T16:24:33Z,,"Potsdam (dpa/bb). Am Königlichen Weinberg in Potsdam wird in diesem Jahr ein guter Jahrgang erwartet. Das Weinjahr 2023 sei sehr herausfordernd gewesen, die Trauben hätten aber hervorragend reifen kö… [+865 chars]",,de,'Weinlese'
https://www.stern.de/gesellschaft/regional/hessen/schwalm-eder-kreis--weinlese-auf-noerdlichstem-weinberg-hessens-startet-33859806.html,https://www.stern.de/gesellschaft/regional/hessen/schwalm-eder-kreis--weinlese-auf-noerdlichstem-weinberg-hessens-startet-33859806.html,0,www.stern.de,Schwalm-Eder-Kreis: Weinlese auf nördlichstem Weinberg Hessens startet,"Bei mildem Herbstwetter hat am Dienstag die Weinernte auf dem nördlichsten Weinberg Hessens begonnen. Auf dem Böddiger Berg in Felsberg (Schwalm-Eder-Kreis) sammelten am Morgen - noch bei Frühnebel - rund 60 Helfer die ersten Trauben. ""Wir erwarten eine ähnli…",https://image.stern.de/33859808/t/DJ/v1/w1440/r1.7778/-/26--urnnewsmldpacom2009010123092699336559v2w800h600l1320t400r3040b2374jpeg---0c8a2286a4f9ab67.jpg,2023-09-26T08:35:08Z,,Bei mildem Herbstwetter hat am Dienstag die Weinernte auf dem nördlichsten Weinberg Hessens begonnen. Auf dem Böddiger Berg in Felsberg (Schwalm-Eder-Kreis) sammelten am Morgen - noch bei Frühnebel -… [+1803 chars],,de,'Weinlese'
https://www.zeit.de/news/2023-09/26/weinlese-auf-noerdlichstem-weinberg-hessens-startet,https://www.zeit.de/news/2023-09/26/weinlese-auf-noerdlichstem-weinberg-hessens-startet,0,www.zeit.de,Schwalm-Eder-Kreis: Weinlese auf nördlichstem Weinberg Hessens startet,,,2023-09-26T08:35:08Z,https://web.archive.org/web/20231001183053/https://www.zeit.de/news/2023-09/26/weinlese-auf-noerdlichstem-weinberg-hessens-startet,"When browsing with ads:
We collect personal data and also transmit it to third-party providers
 that help us improve and finance our digital content. Some of the information stored on your device, … [+821 chars]",,de,'Weinlese'
