index,url,valid,domain,title,description,image,published,archive,content,quote,language,keyword
https://www.stern.de/gesellschaft/regional/baden-wuerttemberg/fussball-bundesliga--bvb-wieder-mit-kobel-und-anton---adeyemi-fehlt-weiter-35247118.html,https://www.stern.de/gesellschaft/regional/baden-wuerttemberg/fussball-bundesliga--bvb-wieder-mit-kobel-und-anton---adeyemi-fehlt-weiter-35247118.html,0,www.stern.de,Fußball-Bundesliga: BVB wieder mit Kobel und Anton - Adeyemi fehlt weiter,Dortmund - Die Personallage bei Borussia Dortmund hat sich vor dem Heimspiel gegen den SC Freiburg weiter entspannt. In der Partie am Samstag (15.30,https://image.stern.de/35247120/t/vA/v1/w1440/r1.7778/-/21--j57dxt5nv7v3axs2048jpeg---a4fbeb3935ee94c8.jpg,2024-11-21T11:41:12Z,https://web.archive.org/web/20241121114748/https://www.stern.de/gesellschaft/regional/baden-wuerttemberg/fussball-bundesliga--bvb-wieder-mit-kobel-und-anton---adeyemi-fehlt-weiter-35247118.html,"Kopiere den aktuellen Link
Für das Heimspiel gegen Freiburg kehren bei Borussia Dortmund mehrere Stammkräfte zurück. Karim Adeyemi und Niklas Süle fehlen dagegen weiter.
Die Personallage bei Boruss… [+1040 chars]",,de,'SC Freiburg'
https://www.kicker.de/letzten-wochen-musste-ich-bis-elf-zaehlen-und-aufstellen-sahin-freut-sich-auf-auswahl-1069395/video,https://www.kicker.de/letzten-wochen-musste-ich-bis-elf-zaehlen-und-aufstellen-sahin-freut-sich-auf-auswahl-1069395/video,0,www.kicker.de,"""Letzten Wochen musste ich bis elf zählen und aufstellen"": Sahin freut sich auf Auswahl","Video: Nuri Sahin hat für das Spiel gegen den SC Freiburg wieder mehr Spieler zur Auswahl. Die Möglichkeit, Entscheidungen für die Aufstellung zu treffen, freut den BVB-Trainer.",https://derivates.kicker.de/image/upload/c_crop%2Cx_0%2Cy_109%2Cw_4000%2Ch_2250/w_1200%2Cq_auto/v1/2024/11/21/d47ff5ef-2826-4714-a5b2-6d5917877339.jpeg,2024-11-21T11:49:48Z,,"Werbung und Tracking: Um dir relevante Inhalte und personalisierte Werbung anzubieten, setzen wir Cookies und andere Technologien ein. Damit messen wir, wie und womit du unsere Angebote nutzt. Diese … [+1979 chars]",,de,'SC Freiburg'
https://www.kicker.de/meine-kinder-waren-im-stadion-schuster-betreibt-selfcare-1069470/video,https://www.kicker.de/meine-kinder-waren-im-stadion-schuster-betreibt-selfcare-1069470/video,0,www.kicker.de,"""Meine Kinder waren im Stadion"": Schuster betreibt ""Selfcare""","Video: Nach einer ersten intensiven Phase mit dem SC Freiburg zu Beginn der Bundesligasaison, entschied sich Freiburg-Trainer Julian Schuster das Spiel der deutschen Nationalmannschaft von zu Hause aus zu verfolgen.",https://derivates.kicker.de/image/upload/w_4000%2Ch_2250%2Cc_fill%2Cg_auto:subject/w_1200%2Cq_auto/v1/2024/11/21/9b67f9aa-fc9a-4968-b9dc-4df31daccf96.jpeg,2024-11-21T14:14:19Z,,"Werbung und Tracking: Um dir relevante Inhalte und personalisierte Werbung anzubieten, setzen wir Cookies und andere Technologien ein. Damit messen wir, wie und womit du unsere Angebote nutzt. Diese … [+1979 chars]",,de,'SC Freiburg'
https://www.kicker.de/hoefler-es-geht-in-richtung-hasebe-1069563/artikel,https://www.kicker.de/hoefler-es-geht-in-richtung-hasebe-1069563/artikel,0,www.kicker.de,"Höfler? ""Es geht in Richtung Hasebe""","Sein Vertrag wurde verlängert, obwohl Nicolas Höfler (34) nach vielen Jahren als Eckpfeiler seinen Stammplatz beim SC Freiburg vorerst verloren hat. Der, der früher mit ihm spielte und ihn jetzt bisher wenig einsetzt, schwärmt vom Routinier - auch mit einem s…",https://derivates.kicker.de/image/upload/w_4000%2Ch_2250%2Cc_fill%2Cg_auto:subject/w_1200%2Cq_auto/v1/2024/11/21/db08374a-457e-4804-a583-488ad684672a.jpeg,2024-11-21T22:35:41Z,https://web.archive.org/web/20241121224359/https://www.kicker.de/hoefler-es-geht-in-richtung-hasebe-1069563/artikel,"Sein Vertrag wurde verlängert, obwohl Nicolas Höfler (34) nach vielen Jahren als Eckpfeiler seinen Stammplatz beim SC Freiburg vorerst verloren hat. Der, der früher mit ihm spielte und ihn jetzt bish… [+5288 chars]",,de,'SC Freiburg'
https://www.kicker.de/noch-mal-grund-zum-feiern-fuer-ginter-1069660/artikel,https://www.kicker.de/noch-mal-grund-zum-feiern-fuer-ginter-1069660/artikel,0,www.kicker.de,Noch mal Grund zum Feiern für Ginter?,"Heute reist Matthias Ginter mit dem SC Freiburg nach Dortmund zum Auswärtsspiel bei seinem Ex-Klub (Samstag, 15.30 Uhr, LIVE! bei kicker). Im Ruhrgebiet war er auch schon Anfang der Woche, die für ihn ganz im Dienst der guten Sache stand.",https://derivates.kicker.de/image/upload/c_crop%2Cx_0%2Cy_937%2Cw_3000%2Ch_1687/w_1200%2Cq_auto/v1/2024/11/22/65a85b89-7f9e-4276-9f3d-a088f75c4697.jpeg,2024-11-22T10:16:02Z,https://web.archive.org/web/20241122110449/https://www.kicker.de/noch-mal-grund-zum-feiern-fuer-ginter-1069660/artikel,"Heute reist Matthias Ginter mit dem SC Freiburg nach Dortmund zum Auswärtsspiel bei seinem Ex-Klub (Samstag, 15.30 Uhr, LIVE! bei kicker). Im Ruhrgebiet war er auch schon Anfang der Woche, die für ih… [+3184 chars]",,de,'SC Freiburg'
https://www.bild.de/sport/fussball/sc-freiburg-fc-bayern-im-tv-livestream-dfb-pokal-der-frauen-am-sonntag-674034babd11045cbd181ac8,https://www.bild.de/sport/fussball/sc-freiburg-fc-bayern-im-tv-livestream-dfb-pokal-der-frauen-am-sonntag-674034babd11045cbd181ac8,0,www.bild.de,Achtelfinale im DFB-Pokal der Frauen - Wo läuft SC Freiburg – FC Bayern live im TV?,"Im DFB-Pokal der Frauen empfängt der SC Freiburg am Sonntag den FC Bayern München. Hier erfahren Sie, wo das Spiel im TV und Livestream läuft.","https://images.bild.de/674034babd11045cbd181ac8/665f95794181573dd601c7582be23474,42e60b37?w=1280",2024-11-22T12:30:44Z,https://web.archive.org/web/20241123024124/https://www.bild.de/sport/fussball/sc-freiburg-fc-bayern-im-tv-livestream-dfb-pokal-der-frauen-am-sonntag-674034babd11045cbd181ac8,"Wer schafft den Sprung ins Viertelfinale?
Am Sonntag stehen die letzten Achtelfinal-Duelle des DFB-Pokals der Frauen an. Zum Abschluss trifft der SC Freiburg auf den FC Bayern München. Anstoß ist um… [+2327 chars]",,de,'SC Freiburg'
https://www.focus.de/sport/fussball/bundesliga1/bundesliga-11-spieltag-konferenz-im-liveticker_id_260504694.html,https://www.focus.de/sport/fussball/bundesliga1/bundesliga-11-spieltag-konferenz-im-liveticker_id_260504694.html,0,www.focus.de,"Bundesliga, 11. Spieltag - Furioses Leverkusen dreht Spiel, BVB schießt Freiburg ab, Hoffenheim schlägt Leipzig","RB Leipzig ließ am Samstag beim 3:4 in Sinsheim gegen Hoffenheim Federn, während Bayer Leverkusen Heidenheim nach 0:2-Rückstand noch mit 5:2 überrannte. Der BVB düpierte derweil den SC Freiburg mit 4:0, der VfL Wolfsburg erkämpfte sich einen 1:0-Sieg gegen Un…",https://p6.focus.de/img/sport/fussball/bundesliga1/id_260505916/heidenheim-leverkusen.jpg?im=Crop%3D%280%2C284%2C3409%2C1704%29%3BResize%3D%281200%2C627%29&impolicy=perceptual&quality=mediumHigh&hash=82cc2a1c2a17dc10a56a0e296d84472788e7274c77f3905c39670af1f689e822,2024-11-22T21:59:57Z,https://web.archive.org/web/20241123021108/https://www.focus.de/sport/fussball/bundesliga1/bundesliga-11-spieltag-konferenz-im-liveticker_id_260504694.html,"RB Leipzig ließ am Samstag beim 3:4 in Sinsheim gegen Hoffenheim Federn, während Bayer Leverkusen Heidenheim nach 0:2-Rückstand noch mit 5:2 überrannte. Der BVB düpierte derweil den SC Freiburg mit 4… [+1897 chars]",,de,'SC Freiburg'
https://www.kicker.de/ewige-tabelle-union-vor-doppel-kunststueck-schnappt-sich-freiburg-den-naechsten-zweitligisten-1068839/artikel,https://www.kicker.de/ewige-tabelle-union-vor-doppel-kunststueck-schnappt-sich-freiburg-den-naechsten-zweitligisten-1068839/artikel,0,www.kicker.de,Ewige Tabelle: Union vor Doppel-Kunststück - Schnappt sich Freiburg den nächsten Zweitligisten?,Am Samstagnachmittag können der SC Freiburg und Union Berlin für Verschiebungen in der Ewigen Tabelle der Bundesliga sorgen. Beide Teams wollen dafür mit langen Negativserien brechen - und Union müsste für ein besonderes Kunststück am Sonntag nach Mönchenglad…,https://derivates.kicker.de/image/upload/c_crop%2Cx_0%2Cy_54%2Cw_4000%2Ch_2250/w_1200%2Cq_auto/v1/2024/11/20/39edfa06-611d-4a67-b5c2-4edf2ea94022.jpeg,2024-11-23T09:55:00Z,https://web.archive.org/web/20241123100110/https://www.kicker.de/ewige-tabelle-union-vor-doppel-kunststueck-schnappt-sich-freiburg-den-naechsten-zweitligisten-1068839/artikel,Am Samstagnachmittag können der SC Freiburg und Union Berlin für Verschiebungen in der Ewigen Tabelle der Bundesliga sorgen. Beide Teams wollen dafür mit langen Negativserien brechen - und Union müss… [+4194 chars],,de,'SC Freiburg'
https://www.welt.de/sport/fussball/bundesliga/sc-freiburg/article254640302/Staatsanwaltschaft-ermittelt-gegen-Klub-aus-Fussball-Bundesliga-und-Eishockey-Zweitligisten.html,https://www.welt.de/sport/fussball/bundesliga/sc-freiburg/article254640302/Staatsanwaltschaft-ermittelt-gegen-Klub-aus-Fussball-Bundesliga-und-Eishockey-Zweitligisten.html,0,www.welt.de,Staatsanwaltschaft ermittelt gegen Bundesliga-Klub und Eishockey-Zweitligisten,Die Staatsanwaltschaft nimmt den SC Freiburg und den EHC Freiburg ins Visier. Es geht um den Verdacht der Vorenthaltung und Veruntreuung von Arbeitsentgelt im Umfeld beider Klubs. Beide Vereine weisen die Vorwürfe zurück.,https://img.welt.de/img/bildergalerien/mobile254640388/3537934827-ci16x9-w1200/Bayer-04-Leverkusen-Holstein-Kiel-2-2.jpg,2024-11-23T10:54:48Z,https://web.archive.org/web/20241123110124/https://www.welt.de/sport/fussball/bundesliga/sc-freiburg/article254640302/Staatsanwaltschaft-ermittelt-gegen-Klub-aus-Fussball-Bundesliga-und-Eishockey-Zweitligisten.html,Die Staatsanwaltschaft nimmt den SC Freiburg und den EHC Freiburg ins Visier. Es geht um den Verdacht der Vorenthaltung und Veruntreuung von Arbeitsentgelt im Umfeld beider Klubs. Beide Vereine weise… [+1888 chars],,de,'SC Freiburg'
https://www.bild.de/sport/fussball/bvb-star-spieler-faellt-kurzfristig-fuer-freiburg-spiel-aus-6741bba528395b4afd88e133,https://www.bild.de/sport/fussball/bvb-star-spieler-faellt-kurzfristig-fuer-freiburg-spiel-aus-6741bba528395b4afd88e133,0,www.bild.de,Wie bitter - BVB-Topstar fällt kurzfristig aus!,"Ein BVB-Star fehlt überraschend beim heutigen Spiel gegen den SC Freiburg, Trainer Nuri Sahin muss umstellen.","https://images.bild.de/6741bba528395b4afd88e133/8ac8beac3d3e2240e6d88a39dbe1c4cc,b6f8f17d?w=1280",2024-11-23T13:18:19Z,https://web.archive.org/web/20241124023331/https://www.bild.de/sport/fussball/bvb-star-spieler-faellt-kurzfristig-fuer-freiburg-spiel-aus-6741bba528395b4afd88e133,"Bittere Nachricht für den BVB!
Stürmer Serhou Guirassy (28) wird für das heutige Spiel gegen den SC Freiburg (15.30 Uhr, Sky und 
im BILD-Liveticker) ausfallen. Das berichten die Ruhr Nachrichten u… [+1240 chars]",,de,'SC Freiburg'
https://www.n-tv.de/sport/fussball/Bayer-Leverkusen-rast-drohender-Blamage-davon-article25382882.html,https://www.n-tv.de/sport/fussball/Bayer-Leverkusen-rast-drohender-Blamage-davon-article25382882.html,0,www.n-tv.de,"BVB siegt hoch, RB böse erwischt: Bayer Leverkusen rast drohender Blamage davon",Zuhause ist Borussia Dortmund eine Macht. Auch der SC Freiburg ist komplett chancenlos. Bayer Leverkusen droht derweil gegen Heidenheim ein nächstes böses Erwachen. Doch der Meister dreht mächtig auf und kann sich vor allem auf Stürmer Patrik Schick verlassen.,https://bilder2.n-tv.de/img/incoming/crop25382917/7821323081-cImg_16_9-w1200/9a67938327ba1a6cc556df38a795020e.jpg,2024-11-23T16:27:08Z,https://web.archive.org/web/20241123164249/https://www.n-tv.de/sport/fussball/Bayer-Leverkusen-rast-drohender-Blamage-davon-article25382882.html,Zuhause ist Borussia Dortmund eine Macht. Auch der SC Freiburg ist komplett chancenlos. Bayer Leverkusen droht derweil gegen Heidenheim ein nächstes böses Erwachen. Doch der Meister dreht mächtig auf… [+15035 chars],,de,'SC Freiburg'
https://www.welt.de/sport/fussball/bundesliga/video254634324/Borussia-Dortmund-SC-Freiburg-Die-Highlights-im-Video-Bundesliga.html,https://www.welt.de/sport/fussball/bundesliga/video254634324/Borussia-Dortmund-SC-Freiburg-Die-Highlights-im-Video-Bundesliga.html,0,www.welt.de,Leidenschaftliches Borussia Dortmund lässt dem SC Freiburg keine Chance,Die Heimserie hält: Borussia Dortmund feiert im sechsten Bundesliga-Heimspiel der Saison den sechsten Sieg. Der BVB nimmt den SC Freiburg auseinander. Schon früh stellt Dortmund die Weichen auf Sieg. Die Highlights im Video.,https://img.welt.de/img/sport/fussball/bundesliga/mobile254645522/1147933977-ci16x9-w1200-fnov-fpotl-fpi157750653/Bundesliga-Borussia-Dortmund-v-SC-Freiburg.jpg,2024-11-23T16:41:31Z,https://web.archive.org/web/20241123164844/https://www.welt.de/sport/fussball/bundesliga/video254634324/Borussia-Dortmund-SC-Freiburg-Die-Highlights-im-Video-Bundesliga.html,Die Heimserie hält: Borussia Dortmund feiert im sechsten Bundesliga-Heimspiel der Saison den sechsten Sieg. Der BVB nimmt den SC Freiburg auseinander. Schon früh stellt Dortmund die Weichen auf Sieg.… [+84 chars],,de,'SC Freiburg'
https://www.kicker.de/sahin-freut-sich-ueber-erwachsene-leistung-1069975/video,https://www.kicker.de/sahin-freut-sich-ueber-erwachsene-leistung-1069975/video,0,www.kicker.de,"Sahin freut sich über ""erwachsene Leistung""","Video: Borussia Dortmund schlägt im eigenen Stadion den SC Freiburg deutlich mit 4:0, sehr zur Freude von Trainer Nuri Sahin. Julien Duranville und Giovanni Reyna feiern jeweils ihr Comeback.",https://derivates.kicker.de/image/upload/c_crop%2Cx_0%2Cy_150%2Cw_3847%2Ch_2164/w_1200%2Cq_auto/v1/2024/11/23/63802fb4-f1e7-4e52-b739-9648cd3886a7.jpeg,2024-11-23T17:43:00Z,https://web.archive.org/web/20241123175714/https://www.kicker.de/sahin-freut-sich-ueber-erwachsene-leistung-1069975/video,"Werbung und Tracking: Um dir relevante Inhalte und personalisierte Werbung anzubieten, setzen wir Cookies und andere Technologien ein. Damit messen wir, wie und womit du unsere Angebote nutzt. Diese … [+1979 chars]",,de,'SC Freiburg'
https://www.kicker.de/das-bereut-er-jetzt-schon-schuster-wegen-adamu-rot-angefressen-1069982/video,https://www.kicker.de/das-bereut-er-jetzt-schon-schuster-wegen-adamu-rot-angefressen-1069982/video,0,www.kicker.de,"""Das bereut er jetzt schon"": Schuster wegen Adamu-Rot angefressen",Video: Vier Gegentore kassierte der SC Freiburg auswärts gegen Dortmund und beendete die Partie nur noch mit neun Spielern. Besonders die rote Karte von Junior Adamu kurz vor Schluss nervte SC-Trainer Julian Schuster besonders.,https://derivates.kicker.de/image/upload/c_crop%2Cx_0%2Cy_279%2Cw_3458%2Ch_1945/w_1200%2Cq_auto/v1/2024/11/23/25628922-6826-4508-87c5-f5b4baeaf771.jpeg,2024-11-23T17:52:22Z,,"Werbung und Tracking: Um dir relevante Inhalte und personalisierte Werbung anzubieten, setzen wir Cookies und andere Technologien ein. Damit messen wir, wie und womit du unsere Angebote nutzt. Diese … [+1979 chars]",,de,'SC Freiburg'
https://www.sueddeutsche.de/sport/bundesliga-dortmund-bvb-freiburg-torschuetzen-heimspiel-li.3152872,https://www.sueddeutsche.de/sport/bundesliga-dortmund-bvb-freiburg-torschuetzen-heimspiel-li.3152872,0,www.sueddeutsche.de,Borussia Dortmund: Es muss an diesem Stadion liegen,Eine Woche vor dem Duell mit den Bayern fährt Borussia Dortmund beim 4:0 den nächsten Heimsieg ein. Der SC Freiburg hadert dagegen mit einer wirklich schlechten Bilanz – und leistet sich einen besonders überflüssigen Platzverweis.,https://www.sueddeutsche.de/2024/11/23/e146d399-9206-47b7-aaf4-f0eefc8b38d9.jpeg?q=60&fm=webp&width=1200&rect=0%2C159%2C3000%2C1687,2024-11-23T18:04:06Z,,"Bei Dortmund hatten die Sorgenkinder der vergangenen und der laufenden Saison zur 2:0-Halbzeitführung getroffen. Maximilian Beier, der den grippeerkrankten Serhou Guirassy in der Sturmspitze vertrat,… [+3726 chars]",,de,'SC Freiburg'
https://www.bild.de/sport/fussball/borussia-dortmund-sc-freiburg-im-live-ticker-bundesliga-heute-673e1e29418f524569fdb4fe,https://www.bild.de/sport/fussball/borussia-dortmund-sc-freiburg-im-live-ticker-bundesliga-heute-673e1e29418f524569fdb4fe,0,www.bild.de,Der Live-Ticker zum Nachlesen - 4:0! BVB schießt sich gegen Freiburg den Frust von der Seele,So lief die Bundesliga-Partie zwischen Borussia Dortmund und dem SC Freiburg.,"https://images.bild.de/673e1e29418f524569fdb4fe/be21e379bac7f84543d59ba32659bcc0,b82a4285?w=1280",2024-11-23T18:31:36Z,,"Borussia Dortmund schlägt den SC Freiburg souverän mit 4:0. Damit springt der BVB in der Bundesliga-Tabelle auf Rang fünf und überholt die Breisgauer.
Spiel verpasst? Kein Problem: Lesen Sie hier im… [+701 chars]",,de,'SC Freiburg'
https://www.kicker.de/brandt-und-sein-besonderes-freistoss-trainingslager-1069971/artikel,https://www.kicker.de/brandt-und-sein-besonderes-freistoss-trainingslager-1069971/artikel,0,www.kicker.de,"Brandt und sein ""besonderes"" Freistoß-Trainingslager","Mit einem direkten Freistoß gegen den SC Freiburg sorgte Julian Brandt für die Entscheidung. Nach der Partie verriet der Torschütze sein ""besonderes"" Trainingslager und lobte den seriösen Auftritt.",https://derivates.kicker.de/image/upload/c_crop%2Cx_0%2Cy_98%2Cw_3514%2Ch_1977/w_1200%2Cq_auto/v1/2024/11/23/1c4646bd-1967-4bc4-a799-3fb0ac6c88ce.jpeg,2024-11-23T18:55:33Z,,"Mit einem direkten Freistoß gegen den SC Freiburg sorgte Julian Brandt für die Entscheidung. Nach der Partie verriet der Torschütze sein ""besonderes"" Trainingslager und lobte den seriösen Auftritt. … [+3161 chars]",,de,'SC Freiburg'
https://www.stern.de/gesellschaft/regional/baden-wuerttemberg/fussball-bundesliga--schuster-sauer-nach-adamu-rot---freiburg-schwach-beim-bvb-35254718.html,https://www.stern.de/gesellschaft/regional/baden-wuerttemberg/fussball-bundesliga--schuster-sauer-nach-adamu-rot---freiburg-schwach-beim-bvb-35254718.html,0,www.stern.de,Fußball-Bundesliga: Schuster sauer nach Adamu-Rot - Freiburg schwach beim BVB,Der SC Freiburg erlebt beim 0:4 in Dortmund einen Nachmittag zum Vergessen. Trainer Julian Schuster ärgerte sich im Endeffekt vor allem über eine Szene.,https://image.stern.de/35254720/t/8o/v1/w1440/r1.7778/-/24--x6asi4y7xiv5axs2048jpeg---52455dfcb528f7df.jpg,2024-11-24T10:35:13Z,https://web.archive.org/web/20241124115636/https://www.stern.de/gesellschaft/regional/baden-wuerttemberg/fussball-bundesliga--schuster-sauer-nach-adamu-rot---freiburg-schwach-beim-bvb-35254718.html,"Kopiere den aktuellen Link
Der SC Freiburg erlebt beim 0:4 in Dortmund einen Nachmittag zum Vergessen. Trainer Julian Schuster ärgerte sich im Endeffekt vor allem über eine Szene.
Zwei Platzverweis… [+1752 chars]",,de,'SC Freiburg'
https://www.kicker.de/trendwende-gefragt-schusters-neue-herausforderung-1070112/artikel,https://www.kicker.de/trendwende-gefragt-schusters-neue-herausforderung-1070112/artikel,0,www.kicker.de,Trendwende gefragt: Schusters neue Herausforderung,"Auch mit neuem Trainer knüpft der SC Freiburg in Dortmund an eine schlechte, alte Tradition an. Generell zeigt der Trend nach unten, was Coach Schuster vor eine knifflige Situation stellt.",https://derivates.kicker.de/image/upload/w_3600%2Ch_2025%2Cc_fill%2Cg_auto:subject/w_1200%2Cq_auto/v1/2024/11/24/85b41bb3-2ce3-4a3f-a379-a0a69c71a608.jpeg,2024-11-24T11:48:58Z,https://web.archive.org/web/20241125060416/https://www.kicker.de/trendwende-gefragt-schusters-neue-herausforderung-1070112/artikel,"Auch mit neuem Trainer knüpft der SC Freiburg in Dortmund an eine schlechte, alte Tradition an. Generell zeigt der Trend nach unten, was Coach Schuster vor eine knifflige Situation stellt. 
 Maxi Eg… [+5245 chars]",,de,'SC Freiburg'
https://www.kicker.de/freiburger-u-23-uebertrifft-die-eigenen-erwartungen-bleibt-aber-sieglos-gegen-die-top-3-1070343/artikel,https://www.kicker.de/freiburger-u-23-uebertrifft-die-eigenen-erwartungen-bleibt-aber-sieglos-gegen-die-top-3-1070343/artikel,0,www.kicker.de,Freiburger U 23 übertrifft die eigenen Erwartungen - bleibt aber sieglos gegen die Top 3,Der SC Freiburg II bleibt in den direkten Duellen mit den Spitzenmannschaften weiter sieglos und verliert erneut gegen ein Top-Team. Das 1:3 bei den Kickers Offenbach war nach zuvor drei Siegen in Serie ein klarer Rückschritt.,https://derivates.kicker.de/image/upload/c_crop%2Cx_0%2Cy_157%2Cw_4000%2Ch_2250/w_1200%2Cq_auto/v1/2024/11/25/d1956b02-1868-404f-b6f9-fb0b8d52c62d.jpeg,2024-11-25T10:39:41Z,,Der SC Freiburg II bleibt in den direkten Duellen mit den Spitzenmannschaften weiter sieglos und verliert erneut gegen ein Top-Team. Das 1:3 bei den Kickers Offenbach war nach zuvor drei Siegen in Se… [+3216 chars],,de,'SC Freiburg'
https://www.zeit.de/news/2024-11/25/laengere-sperre-sc-freiburg-drei-spiele-ohne-adamu,https://www.zeit.de/news/2024-11/25/laengere-sperre-sc-freiburg-drei-spiele-ohne-adamu,0,www.zeit.de,Fußball-Bundesliga: Längere Sperre - SC Freiburg drei Spiele ohne Adamu,Hier finden Sie Informationen zu dem Thema „Fußball-Bundesliga“. Lesen Sie jetzt „Längere Sperre - SC Freiburg drei Spiele ohne Adamu“.,https://img.zeit.de/news/2024-11/25/laengere-sperre-sc-freiburg-drei-spiele-ohne-adamu-image-group/wide__1300x731,2024-11-25T16:34:42Z,,Erst im letzten Bundesliga-Spiel vor Weihnachten gegen Bayer Leverkusen wird der SC Freiburg wieder auf Junior Adamu zurückgreifen können. Das Sportgericht des Deutschen Fußball-Bunds (DFB) sperrte d… [+1163 chars],,de,'SC Freiburg'
https://www.kicker.de/fuer-hartenbach-ein-gutes-beispiel-freiburg-verlaengert-mit-kuebler-1070709/artikel,https://www.kicker.de/fuer-hartenbach-ein-gutes-beispiel-freiburg-verlaengert-mit-kuebler-1070709/artikel,0,www.kicker.de,"Für Hartenbach ein ""gutes Beispiel"": Freiburg verlängert mit Kübler",Die Zusammenarbeit zwischen dem SC Freiburg und Lukas Kübler wird erwartungsgemäß fortgesetzt. Am Dienstag wurde die Vertragsverlängerung des 32-Jährigen offiziell.,https://derivates.kicker.de/image/upload/c_crop%2Cx_0%2Cy_61%2Cw_2000%2Ch_1125/w_1200%2Cq_auto/v1/2024/11/26/dfb0135c-a73e-4a15-8fcc-194e571782a9.gif,2024-11-26T13:30:00Z,,"Die Zusammenarbeit zwischen dem SC Freiburg und Lukas Kübler wird erwartungsgemäß fortgesetzt. Am Dienstag wurde die Vertragsverlängerung des 32-Jährigen offiziell. 
 Der SC Freiburg hält sein Gerüs… [+2128 chars]",,de,'SC Freiburg'
https://www.zeit.de/news/2024-11/26/sc-freiburg-zieht-sich-als-naechster-club-von-x-zurueck,https://www.zeit.de/news/2024-11/26/sc-freiburg-zieht-sich-als-naechster-club-von-x-zurueck,0,www.zeit.de,Fußball-Bundesliga: SC Freiburg zieht sich als nächster Club von X zurück,Hier finden Sie Informationen zu dem Thema „Fußball-Bundesliga“. Lesen Sie jetzt „SC Freiburg zieht sich als nächster Club von X zurück“.,https://img.zeit.de/news/2024-11/26/sc-freiburg-zieht-sich-als-naechster-club-von-x-zurueck-image-group/wide__1300x731,2024-11-26T16:07:54Z,,"Fußball-Bundesligist SC Freiburg verlässt die Social-Media-Plattform X des US-Milliardärs Elon Musk. Der Club begründete die Entscheidung damit, dass auf dem Portal «Werte wie Vielfalt und Toleranz, … [+1113 chars]",,de,'SC Freiburg'
https://www.kicker.de/als-dritter-bundesligist-auch-freiburg-verlaesst-x-und-geht-neue-wege-1070764/artikel,https://www.kicker.de/als-dritter-bundesligist-auch-freiburg-verlaesst-x-und-geht-neue-wege-1070764/artikel,0,www.kicker.de,Als dritter Bundesligist: Auch Freiburg verlässt X - und geht neue Wege,Nach dem FC St. Pauli und Werder Bremen verlässt mit dem SC Freiburg bereits der dritte Bundesligist den Kurznachrichtendienst X. Die Begründung der Breisgauer fällt ausführlich aus.,https://derivates.kicker.de/image/upload/c_crop%2Cx_0%2Cy_249%2Cw_2000%2Ch_1125/w_1200%2Cq_auto/v1/2024/11/26/9ac7ab26-06d5-4356-afcb-1c25dde146bb.gif,2024-11-26T16:58:01Z,,"Nach dem FC St. Pauli und Werder Bremen verlässt mit dem SC Freiburg bereits der dritte Bundesligist den Kurznachrichtendienst X. Die Begründung der Breisgauer fällt ausführlich aus. 
 Neu ist diese… [+1819 chars]",,de,'SC Freiburg'
https://www.zeit.de/news/2024-11/28/sc-freiburg-bindet-auch-abwehr-talent-rosenfelder,https://www.zeit.de/news/2024-11/28/sc-freiburg-bindet-auch-abwehr-talent-rosenfelder,0,www.zeit.de,Fußball-Bundesliga: SC Freiburg bindet auch Abwehr-Talent Rosenfelder,Hier finden Sie Informationen zu dem Thema „Fußball-Bundesliga“. Lesen Sie jetzt „SC Freiburg bindet auch Abwehr-Talent Rosenfelder“.,https://img.zeit.de/news/2024-11/28/sc-freiburg-bindet-auch-abwehr-talent-rosenfelder-image-group/wide__1300x731,2024-11-28T13:15:14Z,,Der SC Freiburg hat die nächste Vertragsverlängerung bekanntgegeben. U21-Nationalspieler Max Rosenfelder erhält einen neuen Kontrakt beim badischen Fußball-Bundesligisten. Zur Laufzeit machte der Clu… [+757 chars],,de,'SC Freiburg'
https://www.kicker.de/schon-wieder-verlaengert-freiburg-belohnt-rosenfelder-1071364/artikel,https://www.kicker.de/schon-wieder-verlaengert-freiburg-belohnt-rosenfelder-1071364/artikel,0,www.kicker.de,Schon wieder verlängert: Freiburg belohnt Rosenfelder,Wie schon vor vier Monaten hat der SC Freiburg den Vertrag mit Max Rosenfelder erneut verlängert. Der bekennende SC-Fan beeindruckt die Verantwortlichen nicht nur mit seinem Tempo.,https://derivates.kicker.de/image/upload/c_crop%2Cx_0%2Cy_152%2Cw_4000%2Ch_2250/w_1200%2Cq_auto/v1/2024/11/28/e10cab0d-8d20-4010-ba5c-6d159e903bc5.jpeg,2024-11-28T13:35:15Z,,"Wie schon vor vier Monaten hat der SC Freiburg den Vertrag mit Max Rosenfelder erneut verlängert. Der bekennende SC-Fan beeindruckt die Verantwortlichen nicht nur mit seinem Tempo. 
 ""Max Rosenfelde… [+2067 chars]",,de,'SC Freiburg'
