index,url,valid,domain,title,description,image,published,archive,content,quote,language,keyword
https://www.stern.de/gesellschaft/regional/rheinland-pfalz-saarland/bundesligen--mainz-vor-schwerer-aufgabe-in-freiburg---fck-gegen-magdeburg-35194762.html,https://www.stern.de/gesellschaft/regional/rheinland-pfalz-saarland/bundesligen--mainz-vor-schwerer-aufgabe-in-freiburg---fck-gegen-magdeburg-35194762.html,0,www.stern.de,Bundesligen: Mainz vor schwerer Aufgabe in Freiburg - FCK gegen Magdeburg,Der FSV Mainz 05 steht vor einer schweren Aufgabe beim SC Freiburg. Der 1. FC Kaiserslautern will mit einem Erfolg gegen Magdeburg weiteres Selbstvertrauen tanken.,https://image.stern.de/35194764/t/8U/v1/w1440/r1.7778/-/03--4mbdvwy7u4v21axw800h600jpeg---c13acbb15b348f9a.jpg,2024-11-03T02:30:36Z,,"Kopiere den aktuellen Link
Der FSV Mainz 05 steht vor einer schweren Aufgabe beim SC Freiburg. Der 1. FC Kaiserslautern will mit einem Erfolg gegen Magdeburg weiteres Selbstvertrauen tanken.
Beim F… [+759 chars]",,de,'SC Freiburg'
https://www.focus.de/sport/fussball/bundesliga1/bundesliga-9-spieltag-sc-freiburg-gegen-mainz-05-im-liveticker_id_260447650.html,https://www.focus.de/sport/fussball/bundesliga1/bundesliga-9-spieltag-sc-freiburg-gegen-mainz-05-im-liveticker_id_260447650.html,0,www.focus.de,"Bundesliga, 9. Spieltag - SC Freiburg gegen Mainz 05 im Liveticker","Der SC Freiburg hat die Chance, in der Bundesliga auf Rang drei zu springen. Dafür muss für die Breisgauer ein Sieg gegen Mainz 05 her. Für die Mainzer geht es nach der 0:4-Pokalniederlage gegen die Bayern darum, sich etwas aus dem Abstiegskampf zu befreien. …",https://p6.focus.de/img/regional/baden-wuerttemberg/id_260443739/freiburgs-matthias-ginter-r.-traf-am-mittwoch-im-dfb-pokal-gegen-den-hamburger-sv..jpg?im=Crop%3D%280%2C0%2C2048%2C1024%29%3BResize%3D%281200%2C627%29&impolicy=perceptual&quality=mediumHigh&hash=c782036a454da20fbe6a4f7dae09093e23895b8231f893d865d08dd97dd9cff7,2024-11-03T11:12:33Z,,"Der SC Freiburg hat die Chance, in der Bundesliga auf Rang drei zu springen. Dafür muss für die Breisgauer ein Sieg gegen Mainz 05 her. Für die Mainzer geht es nach der 0:4-Pokalniederlage gegen die … [+927 chars]",,de,'SC Freiburg'
https://www.zeit.de/news/2024-11/03/doan-weggang-aus-freiburg-im-winter-kein-thema,https://www.zeit.de/news/2024-11/03/doan-weggang-aus-freiburg-im-winter-kein-thema,0,www.zeit.de,SC Freiburg: Doan-Weggang aus Freiburg im Winter «kein Thema»,"Hier finden Sie Informationen zu dem Thema „SC Freiburg“. Lesen Sie jetzt „Doan-Weggang aus Freiburg im Winter ""kein Thema""“.",https://img.zeit.de/news/2024-11/03/doan-weggang-aus-freiburg-im-winter-kein-thema-image-group/wide__1300x731,2024-11-03T14:40:38Z,,"Der SC Freiburg ist Gerüchten über einen möglichen Wechsel von Ritsu Doan in der Winterpause entgegengetreten. Das sei überhaupt kein Thema, sagte Sportvorstand Jochen Saier am Rande des Spiels in de… [+468 chars]",,de,'SC Freiburg'
https://www.stern.de/gesellschaft/regional/baden-wuerttemberg/sc-freiburg--doan-weggang-aus-freiburg-im-winter--kein-thema--35195694.html,https://www.stern.de/gesellschaft/regional/baden-wuerttemberg/sc-freiburg--doan-weggang-aus-freiburg-im-winter--kein-thema--35195694.html,0,www.stern.de,"SC Freiburg: Doan-Weggang aus Freiburg im Winter ""kein Thema""",Ritsu Doan spielt sich beim SC Freiburg immer mehr in den Mittelpunkt und weckt damit das Interesse anderer Clubs. Die Breisgauer wollen den Japaner aber nicht vorzeitig ziehen lassen.,https://image.stern.de/35195696/t/te/v1/w1440/r1.7778/-/03--6l73ifwq6gv12axw800h600jpeg---56595b331c970ecf.jpg,2024-11-03T14:40:38Z,,"Kopiere den aktuellen Link
Ritsu Doan spielt sich beim SC Freiburg immer mehr in den Mittelpunkt und weckt damit das Interesse anderer Clubs. Die Breisgauer wollen den Japaner aber nicht vorzeitig z… [+682 chars]",,de,'SC Freiburg'
https://www.tagesspiegel.de/sport/sc-freiburg-doan-weggang-aus-freiburg-im-winter-kein-thema-12637943.html,https://www.tagesspiegel.de/sport/sc-freiburg-doan-weggang-aus-freiburg-im-winter-kein-thema-12637943.html,0,www.tagesspiegel.de,SC Freiburg: Doan-Weggang aus Freiburg im Winter „kein Thema“,Ritsu Doan spielt sich beim SC Freiburg immer mehr in den Mittelpunkt und weckt damit das Interesse anderer Clubs. Die Breisgauer wollen den Japaner aber nicht vorzeitig ziehen lassen.,https://www.tagesspiegel.de/images/12637940/alternates/BASE_16_9_W1400/1730644896000/ritsu-doan.jpeg,2024-11-03T14:41:36Z,,"Der SC Freiburg ist Gerüchten über einen möglichen Wechsel von Ritsu Doan in der Winterpause entgegengetreten. Das sei überhaupt kein Thema, sagte Sportvorstand Jochen Saier am Rande des Spiels in de… [+560 chars]",,de,'SC Freiburg'
https://www.transfermarkt.de/sc-freiburg-dementiert-gerucht-winterabgang-von-doan-kein-thema-quot-/view/news/445770,https://www.transfermarkt.de/sc-freiburg-dementiert-gerucht-winterabgang-von-doan-kein-thema-quot-/view/news/445770,0,www.transfermarkt.de,SC Freiburg dementiert Gerücht: Winterabgang von Doan „kein Thema“,"Der SC Freiburg ist Gerüchten über einen möglichen Wechsel von Ritsu Doan in der Winterpause entgegengetreten. Das sei überhaupt kein Thema, sagte Sportvorstand Jochen Saier am...",https://tmssl.akamaized.net/images/foto/big/ritsu-doan-sc-freiburg-2024-2025-1728293053-150514.jpg?lm=1728293066,2024-11-03T15:38:50Z,,"Der SC Freiburg ist Gerüchten über einen möglichen Wechsel von Ritsu Doan in der Winterpause entgegengetreten. Das sei überhaupt kein Thema, sagte Sportvorstand Jochen Saier am Rande des Spiels in de… [+1083 chars]",,de,'SC Freiburg'
https://www.welt.de/sport/fussball/bundesliga/video254335516/Atubolu-sichert-Remis-Glanzparade-verhindert-Mainz-Sieg-Freiburg-verpasst-Sprung-auf-Platz-drei.html,https://www.welt.de/sport/fussball/bundesliga/video254335516/Atubolu-sichert-Remis-Glanzparade-verhindert-Mainz-Sieg-Freiburg-verpasst-Sprung-auf-Platz-drei.html,0,www.welt.de,Glanzparade verhindert Mainz-Sieg – Freiburg verpasst Sprung auf Platz drei,"Der SC Freiburg kommt gegen Mainz 05 nicht über ein Remis hinaus und verpassen damit den Sprung auf den dritten Tabellenrang. Die beste Chance der Partie haben die Mainzer, doch Torwart Atubolu reagiert glänzend und lässt sich anschließend feiern. Die Highlig…",https://img.welt.de/img/sport/fussball/bundesliga/mobile254335514/0867939367-ci16x9-w1200-fnov-fpotl-fpi157750653/Sport-Club-Freiburg-v-1-FSV-Mainz-05-Bundesliga.jpg,2024-11-03T16:28:56Z,,"Der SC Freiburg kommt gegen Mainz 05 nicht über ein Remis hinaus und verpassen damit den Sprung auf den dritten Tabellenrang. Die beste Chance der Partie haben die Mainzer, doch Torwart Atubolu reagi… [+118 chars]",,de,'SC Freiburg'
