index,url,valid,domain,title,description,image,published,archive,content,quote,language,keyword
https://www.transfermarkt.de/sallai-forciert-abschied-vom-sc-freiburg-ndash-beraterwechsel-zu-bdquo-icm-stellar-sports-ldquo-/view/news/413873,https://www.transfermarkt.de/sallai-forciert-abschied-vom-sc-freiburg-ndash-beraterwechsel-zu-bdquo-icm-stellar-sports-ldquo-/view/news/413873,0,www.transfermarkt.de,SC Freiburg: Roland Sallai forciert Abschied – Wechselt Berateragentur,"Roland Sallai stand für den SC Freiburg verletzungsbedingt in der laufenden Saison lediglich 479 Minuten in zehn Pflichtspielen (ein Tor) auf dem Platz, vor allem seit der Genesung...",https://tmssl.akamaized.net/images/foto/big/roland-sallai-sc-freiburg-2022-1663175271-92385.jpg?lm=1663175286,2022-11-17T07:15:30Z,https://web.archive.org/web/20221117072005/https://www.transfermarkt.de/sallai-forciert-abschied-vom-sc-freiburg-ndash-beraterwechsel-zu-bdquo-icm-stellar-sports-ldquo-/view/news/413873,"Nach Verletzung ohne Stammplatz 
Roland Sallai stand für den SC Freiburg verletzungsbedingt in der laufenden Saison lediglich 479 Minuten in zehn Pflichtspielen (ein Tor) auf dem Platz, vor allem se… [+1004 chars]",,de,'SC Freiburg'
https://www.stern.de/sport/fussball/unter-streich-nur-reservist--freiburg-star-forciert-wechsel-32920422.html,https://www.stern.de/sport/fussball/unter-streich-nur-reservist--freiburg-star-forciert-wechsel-32920422.html,0,www.stern.de,Unter Streich nur Reservist: Freiburg-Star forciert Wechsel,Roland Sallai möchte den SC Freiburg verlassen. Mit einem Wechsel seiner Berateragentur untermauert er seinen Wechselwunsch.,https://image.stern.de/32920424/t/qh/v1/w1440/r1.7778/-/17--unter-streich-nur-reservist--freiburg-star-forciert-wechsel--aufmacher-.jpg,2022-11-17T09:13:00Z,https://web.archive.org/web/20221117092709/https://www.stern.de/sport/fussball/unter-streich-nur-reservist--freiburg-star-forciert-wechsel-32920422.html,"Roland Sallai möchte den SC Freiburg verlassen. Mit einem Wechsel seiner Berateragentur untermauert er seinen Wechselwunsch.
Beim SC Freiburg schafft Roland Sallai es nicht mehr in die erste Reihe. … [+1527 chars]",,de,'SC Freiburg'
https://www.kicker.de/grifo-show-italienische-presse-begeistert-vom-deutschen-926131/artikel,https://www.kicker.de/grifo-show-italienische-presse-begeistert-vom-deutschen-926131/artikel,0,www.kicker.de,"""Grifo-Show"": Italienische Presse begeistert vom ""Deutschen""","Vincenzo Grifo (29) verzückt dieser Tage nicht nur die Fans des SC Freiburg. Nach dem 3:1 in Albanien sang die italienische Presse ein Loblied auf den ""Deutschen"".","https://derivates.kicker.de/image/upload/c_crop,x_0,y_160,w_2000,h_1125/w_1200,q_auto/v1/2022/11/17/0f079bc1-8aeb-422c-8ee2-709f02c9248f.jpeg",2022-11-17T10:19:57Z,https://web.archive.org/web/20221117102152/https://www.kicker.de/grifo-show-italienische-presse-begeistert-vom-deutschen-926131/artikel,"Vincenzo Grifo (29) verzückt dieser Tage nicht nur die Fans des SC Freiburg. Nach dem 3:1 in Albanien sang die italienische Presse ein Loblied auf den ""Deutschen"". 
 Nur drei Tage nach seinem Hattri… [+2496 chars]",,de,'SC Freiburg'
https://www.kicker.de/was-hartenbach-ueber-flekkens-wm-ausbootung-denkt-926546/artikel,https://www.kicker.de/was-hartenbach-ueber-flekkens-wm-ausbootung-denkt-926546/artikel,0,www.kicker.de,Was Hartenbach über Flekkens WM-Ausbootung denkt,"Am Montag sind die Niederlande gegen Senegal in die WM gestartet - komplett ohne Mark Flekken (29). Überraschend wie fragwürdig, hat der Stammkeeper doch großen Anteil am beeindruckenden Freiburger Erfolg. SC-Sportdirektor Klemens Hartenbach bezieht Stellung.","https://derivates.kicker.de/image/upload/c_crop,x_0,y_102,w_3500,h_1969/w_1200,q_auto/v1/2022/11/20/578b8c22-5dc2-41af-87fc-61c8e318ccff.jpeg",2022-11-21T17:30:00Z,,"Am Montag sind die Niederlande gegen Senegal in die WM gestartet - komplett ohne Mark Flekken (29). Überraschend wie fragwürdig, hat der Stammkeeper doch großen Anteil am beeindruckenden Freiburger E… [+4448 chars]",,de,'SC Freiburg'
https://www.jungewelt.de/artikel/439412.satire-dicke-alte-weiße-männer-ärgern.html,https://www.jungewelt.de/artikel/439412.satire-dicke-alte-weiße-männer-ärgern.html,0,www.jungewelt.de,"Satire: »Dicke, alte, weiße Männer ärgern«",Martin Sonneborns Bildervortrag »Krawall und Satire« auf Kampnagel in Hamburg • Foto: Arne Dedert/dpa,https://www.jungewelt.de/img/1100/174176.jpg,2022-11-23T18:37:35Z,https://web.archive.org/web/20221123183902/http://www.jungewelt.de/artikel/439412.satire-dicke-alte-wei%C3%9Fe-m%C3%A4nner-%C3%A4rgern.html,"Dass die Partei Die PARTEI ein Problem mit einem ausgeglichenen Geschlechterverhältnis ihrer Mitglieder hat, ist bekannt. Der Infotisch, den die Mitglieder am Sonnabend in der Hamburger Theaterfabrik… [+4546 chars]",,de,'Martin Sonneborn'
https://www.transfermarkt.de/freiburg-verlangert-mit-routinier-hofler-ndash-unter-5-treuesten-bundesliga-profis/view/news/414195,https://www.transfermarkt.de/freiburg-verlangert-mit-routinier-hofler-ndash-unter-5-treuesten-bundesliga-profis/view/news/414195,0,www.transfermarkt.de,SC Freiburg verlängert mit Nicolas Höfler – Unter treuesten Bundesliga-Profis,"Nicolas Höfler hat seinen Vertrag beim SC Freiburg erneut verlängert. Der 32 Jahre alte defensive Mittelfeldspieler stieg 2010 zu den Profis bei den Breisgauern auf, nachdem er zuvor...",https://tmssl.akamaized.net/images/foto/big/nicolas-hofler-sc-freiburg-2021-1637227661-74983.jpg?lm=1637227671,2022-11-24T13:11:13Z,,"Nicolas Höfler hat seinen Vertrag beim SC Freiburg erneut verlängert. Der 32 Jahre alte defensive Mittelfeldspieler stieg 2010 zu den Profis bei den Breisgauern auf, nachdem er zuvor mehrere Jahre di… [+1167 chars]",,de,'SC Freiburg'
https://www.zeit.de/news/2022-11/24/sc-freiburg-verlaengert-mit-anker-und-taktgeber-hoefler,https://www.zeit.de/news/2022-11/24/sc-freiburg-verlaengert-mit-anker-und-taktgeber-hoefler,0,www.zeit.de,Bundesliga: SC Freiburg verlängert mit «Anker und Taktgeber» Höfler,,,2022-11-24T13:26:17Z,,"When browsing with ads:
We collect personal data and also transmit it to third-party providers
 that help us improve and finance our digital content. Some of the information stored on your device, … [+732 chars]",,de,'SC Freiburg'
