index,url,valid,domain,title,description,image,published,archive,content,quote,language,keyword
https://sport.orf.at/stories/3132476/,https://sport.orf.at/stories/3132476/,0,sport.orf.at,Adamu-Doppelpack lässt Freiburg jubeln,Junior Adamu hat am Samstag seine ersten beiden Tore in der deutschen Bundesliga erzielt und damit den SC Freiburg zu einem 2:1-Heimsieg gegen den VfL Bochum geschossen. Der ÖFB-Teamspieler drehte innerhalb von drei Minuten einen Rückstand. Während RB Leipzig…,https://ibs.orf.at/sport?image=https%3A%2F%2Fassets.orf.at%2Fmims%2F2024%2F37%2F18%2Fcrops%2Fw%3D1200%2Ch%3D630%2Cq%3D75%2F2350271_master_896018_fus_ger_runde3_samstag_freiburg_bochum_adamu_im.jpg%3Fs%3D020c4e2690264bda6c90d0eac293a81d605bb791,2024-09-14T15:57:21Z,,"Adamu, zuletzt im Nations-League-Doppel gegen Slowenien (1:1) und Norwegen (1:2) eingewechselt bzw. im Kader, schnürte nach der Pause einen Doppelpack (58., 61.) gegen die von Ex-Salzburg-Trainer Pet… [+4090 chars]",,de,'SC Freiburg'
https://www.kicker.de/schuster-lobt-fleissigen-adamu-und-sorgt-sich-um-roehl-1051156/artikel,https://www.kicker.de/schuster-lobt-fleissigen-adamu-und-sorgt-sich-um-roehl-1051156/artikel,0,www.kicker.de,"Schuster lobt ""fleißigen"" Adamu - und sorgt sich um Röhl",Nach dem Comeback-Sieg gegen den VfL Bochum sorgt sich der SC Freiburg um Merlin Röhl. Der aufstrebende Mittelfeldmann musste aufgrund einer Sprunggelenksverletzung vom Platz - und wird Julian Schuster wohl länger fehlen.,https://derivates.kicker.de/image/upload/c_crop%2Cx_308%2Cy_433%2Cw_2670%2Ch_1502/w_1200%2Cq_auto/v1/2024/09/14/8c0ab756-dee1-4c99-aa37-e67cc658caaa.jpeg,2024-09-14T19:05:44Z,https://web.archive.org/web/20240914192718/https://www.kicker.de/schuster-lobt-fleissigen-adamu-und-sorgt-sich-um-roehl-1051156/artikel,Nach dem Comeback-Sieg gegen den VfL Bochum sorgt sich der SC Freiburg um Merlin Röhl. Der aufstrebende Mittelfeldmann musste aufgrund einer Sprunggelenksverletzung vom Platz - und wird Julian Schust… [+2652 chars],,de,'SC Freiburg'
https://www.stern.de/gesellschaft/regional/baden-wuerttemberg/fussball-bundesliga--freiburger-fans-feiern-tor-debuetant-adamu-35064798.html,https://www.stern.de/gesellschaft/regional/baden-wuerttemberg/fussball-bundesliga--freiburger-fans-feiern-tor-debuetant-adamu-35064798.html,0,www.stern.de,Fußball-Bundesliga: Freiburger Fans feiern Tor-Debütant Adamu,Junior Adamu macht den SC Freiburg glücklich - und sich gleich mit. Seine ersten Bundesliga-Tore honorieren die Fans ganz besonders. Und auch sein Trainer findet lobende Worte.,https://image.stern.de/35064800/t/nY/v1/w1440/r1.7778/-/15--anksbvztj7v10axw800h600jpeg---84826ab32622c05c.jpg,2024-09-15T02:22:36Z,https://web.archive.org/web/20240915025255/https://www.stern.de/gesellschaft/regional/baden-wuerttemberg/fussball-bundesliga--freiburger-fans-feiern-tor-debuetant-adamu-35064798.html,"Junior Adamu macht den SC Freiburg glücklich - und sich gleich mit. Seine ersten Bundesliga-Tore honorieren die Fans ganz besonders. Und auch sein Trainer findet lobende Worte.
Junior Adamu war am S… [+2206 chars]",,de,'SC Freiburg'
https://www.transfermarkt.de/erste-bundesliga-tore-fur-adamu-freiburg-fans-feiern-sturmer-es-ist-wie-ein-traum-quot-/view/news/443881,https://www.transfermarkt.de/erste-bundesliga-tore-fur-adamu-freiburg-fans-feiern-sturmer-es-ist-wie-ein-traum-quot-/view/news/443881,0,www.transfermarkt.de,"SC Freiburg: Erste Bundesliga-Tore für Adamu, Fans feiern Stürmer","Junior Adamu war am Samstag ein begehrter Zaungast. Vor allem bei den Fans des SC Freiburg, die ihren Doppelpack-Stürmer nach dem 2:1 am Samstag gegen den VfL Bochum direkt aufs...",https://tmssl.akamaized.net/images/foto/big/junior-adamu-sc-freiburg-2024-1726402430-148024.jpg?lm=1726402439,2024-09-15T12:18:56Z,,"5 Scorer nach schwerem 1. Jahr 
Junior Adamu war am Samstag ein begehrter Zaungast. Vor allem bei den Fans des SC Freiburg, die ihren Doppelpack-Stürmer nach dem 2:1 am Samstag gegen den VfL Bochum … [+1924 chars]",,de,'SC Freiburg'
https://www.kicker.de/eggestein-ueber-saisonstart-nicht-sehr-gut-aber-gut-1051639/artikel,https://www.kicker.de/eggestein-ueber-saisonstart-nicht-sehr-gut-aber-gut-1051639/artikel,0,www.kicker.de,"Eggestein über Saisonstart: ""Nicht sehr gut, aber gut""",Wie im ersten Heimspiel gegen den VfB Stuttgart drehte der SC Freiburg auch gegen den VfL Bochum einen Rückstand noch in einen Sieg.,https://derivates.kicker.de/image/upload/c_crop%2Cx_208%2Cy_50%2Cw_2953%2Ch_1661/w_1200%2Cq_auto/v1/2024/09/16/f7e45d82-50e4-4dfa-90a7-ad93f193162d.jpeg,2024-09-16T17:01:50Z,,"Wie im ersten Heimspiel gegen den VfB Stuttgart drehte der SC Freiburg auch gegen den VfL Bochum einen Rückstand noch in einen Sieg. 
 ""Natürlich wäre es mir lieber, wenn wir nicht jedes Mal einem R… [+3088 chars]",,de,'SC Freiburg'
